Name,Category,Vendor,Price,ApproxRangeCost,PricePerLb,Is_Subscribed,Is_Sold_Out,Scraped_At
Cashew Butter & Vanilla Dark Chocolate Bar (Paleo),pantry,Hu KitchenHu Kitchen,$6.99,2.1 Ounce,,False,False,2025-03-08T10:33:48.043844
Apple Crisp Dark Chocolate Bar,pantry,Raaka ChocolateRaaka Chocolate,$7.99,1.8 oz,,False,False,2025-03-08T10:33:48.067576
Ginger Snap Dark Chocolate Bar,pantry,Raaka ChocolateRaaka Chocolate,$6.49,1.8 oz,,False,False,2025-03-08T10:33:48.090128
Coconut Milk Chocolate Bar,pantry,Raaka ChocolateRaaka Chocolate,$6.49,1 bar,,False,False,2025-03-08T10:33:48.113851
Green Tea Crunch Chocolate Bar,pantry,Raaka ChocolateRaaka Chocolate,$6.49,1 bar,,False,False,2025-03-08T10:33:48.136304
Bourbon Cask Aged Chocolate Bar,pantry,Raaka ChocolateRaaka Chocolate,$6.49,1 bar,,False,False,2025-03-08T10:33:48.159742
Peppermint White Chocolate Waffle Cone Bar,pantry,Raaka ChocolateRaaka Chocolate,$5.49,1.0 Ounce,,False,False,2025-03-08T10:33:48.182248
Day Break Functional Dark Chocolate,pantry,Raaka ChocolateRaaka Chocolate,$4.07,1.0 Ounce,,False,False,2025-03-08T10:33:48.205682
Mellow Moon Functional Dark Chocolate,pantry,Raaka ChocolateRaaka Chocolate,$4.79,1.0 Ounce,,False,False,2025-03-08T10:33:48.227750
Chocolate Waffle Cone Bar,pantry,Raaka ChocolateRaaka Chocolate,$5.49,1.0 Ounce,,False,False,2025-03-08T10:33:48.251400
Winter Citrus Mini Bars,pantry,Raaka ChocolateRaaka Chocolate,$39.99,40 mini bars (11.2 oz),,False,False,2025-03-08T10:33:48.273524
4pc Mixed Truffle Box,pantry,Fine & Raw ChocolateFine & Raw Chocolate,$13.59,2.0 Ounce,,False,False,2025-03-08T10:33:48.297157
Chocolate Hazelnut Butter Spread,pantry,Fine & Raw ChocolateFine & Raw Chocolate,$14.99,8.0 Ounce,,False,False,2025-03-08T10:33:48.319821
Crème Chocolat French Dessert,pantry,La FermièreLa Fermière,$3.49,4.4 Ounce,,False,False,2025-03-08T10:33:48.344196
Crème Vanille French Dessert,pantry,La FermièreLa Fermière,$3.99,4.4 Ounce,,False,False,2025-03-08T10:33:48.366044
Crème Caramel French Dessert,pantry,La FermièreLa Fermière,$3.49,4.4 Ounce,,False,False,2025-03-08T10:33:48.389168
Upcycled Sugar Cookie Mix,pantry,Renewal MillRenewal Mill,$9.99,15.0 Ounce,,False,False,2025-03-08T10:33:48.410901
Vegan Marshmallows,pantry,DandiesDandies,$6.59,10.0 Ounce,,False,False,2025-03-08T10:33:48.433917
Dark Hot Chocolate Mix,pantry,Equal Exchange Fairly TradedEqual Exchange Fairly...,$10.39,12.0 Ounce,,False,False,2025-03-08T10:33:48.455984
Hot Cocoa Mix,pantry,Equal Exchange Fairly TradedEqual Exchange Fairly...,$10.39,12.0 Ounce,,False,False,2025-03-08T10:33:48.478891
8pc Mixed Truffle Box,pantry,Fine & Raw ChocolateFine & Raw Chocolate,$24.99,4.0 Ounce,,False,False,2025-03-08T10:33:48.501275
Chocolate Cake Truffle Bar,pantry,Honey Mama'sHoney Mama's,$6.29,2.5 oz,,False,False,2025-03-08T10:33:48.524687
Salted Almond Truffle Bar,pantry,Honey Mama'sHoney Mama's,$6.29,2.5 oz,,False,False,2025-03-08T10:33:48.546818
Coconut Truffle Bar,pantry,Honey Mama'sHoney Mama's,$6.29,2.5 oz,,False,False,2025-03-08T10:33:48.570533
The OG Cracker Cookies,pantry,Legally AddictiveLegally Addictive,$10.99,4.7 Ounce,,False,False,2025-03-08T10:33:48.592447
Churro Graham Cracker Cookies,pantry,Legally AddictiveLegally Addictive,$10.99,4.7 Ounce,,False,False,2025-03-08T10:33:48.616002
Mexican Hot Chocolate Cracker Cookies,pantry,Legally AddictiveLegally Addictive,$10.99,4.7 oz,,False,False,2025-03-08T10:33:48.638255
Vanilla Bean Marshmallows,pantry,Hudson Valley Marshmallow Co.Hudson Valley Marshma...,$6.99,4.0 Ounce,,False,False,2025-03-08T10:33:48.662230
Chocolate Chip Marshmallows,pantry,Hudson Valley Marshmallow Co.Hudson Valley Marshma...,$6.99,4.0 Ounce,,False,False,2025-03-08T10:33:48.684485
Salted Caramel Marshmallows,pantry,Hudson Valley Marshmallow Co.Hudson Valley Marshma...,$6.99,4.0 oz,,False,False,2025-03-08T10:33:48.707558
Crème Cafe French Dessert,pantry,La FermièreLa Fermière,$3.49,4.4 oz,,False,False,2025-03-08T10:33:48.729643
Raspberry Waffle Crunch Dark Chocolate,pantry,Raaka ChocolateRaaka Chocolate,$9.99,1.8 oz,,False,False,2025-03-08T10:33:48.752340
Pistachio Halva,pantry,Seed & MillSeed & Mill,$14.99,8.0 Ounce,,False,False,2025-03-08T10:33:48.774762
Dark Chocolate and Sea Salt Halva,pantry,Seed & MillSeed & Mill,$14.99,8.0 Ounce,,False,False,2025-03-08T10:33:48.797835
Chocolate Covered Hazelnuts,pantry,Freddy Guy's HazelnutsFreddy Guy's Hazelnut...,$12.99,7.0 Ounce,,False,True,2025-03-08T10:33:48.820137
Almond Sea Salt Chocolate Hunks (Paleo),pantry,Hu KitchenHu Kitchen,$8.99,4.0 Ounce,,False,True,2025-03-08T10:33:48.843011
Hazelnut Butter Dark Chocolate Bar,pantry,Hu KitchenHu Kitchen,$6.99,2.1 Ounce,,False,True,2025-03-08T10:33:48.865186
Dried Apple Rings (Organic),pantry,Boxford BakehouseBoxford Bakehouse,$9.99,6.0 oz,,False,False,2025-03-08T10:33:48.888687
Dried Pineapple Rings (Organic),pantry,Boxford BakehouseBoxford Bakehouse,$9.99,6.0 oz,,False,False,2025-03-08T10:33:48.910464
Mangoes a-go-go Fruit Leather,pantry,You Love FruitYou Love Fruit,$5.99,6 .5 oz pouches,,False,False,2025-03-08T10:33:48.933782
Apple & Cinnasidekick Fruit Leather,pantry,You Love FruitYou Love Fruit,$5.99,6 .5 oz pouches,,False,False,2025-03-08T10:33:48.956085
Cheery Cherry Mango Fruit Leather,pantry,You Love FruitYou Love Fruit,$5.99,6 .5 oz pouches,,False,False,2025-03-08T10:33:48.979109
Kiwi Berry Buddies Fruit Leather,pantry,You Love FruitYou Love Fruit,$5.99,6 .5 oz pouches,,False,False,2025-03-08T10:33:49.001581
Passion Fruit Power Pals Fruit Leather,pantry,You Love FruitYou Love Fruit,$5.99,6 .5 oz pouches,,False,False,2025-03-08T10:33:49.024735
Super Berry Fruit Leather,pantry,You Love FruitYou Love Fruit,$5.99,6 .5 oz pouches,,False,False,2025-03-08T10:33:49.047091
Medjool Dates,pantry,Boxford BakehouseBoxford Bakehouse,$9.19,8.0 Ounce,,False,False,2025-03-08T10:33:49.090908
Raw Walnuts,pantry,Boxford BakehouseBoxford Bakehouse,$10.59,6.0 Ounce,,False,False,2025-03-08T10:33:49.113905
Tierra Trail Mix,pantry,Boxford BakehouseBoxford Bakehouse,$7.99,8.0 Ounce,,False,False,2025-03-08T10:33:49.158367
Roasted Unsalted Cashews,pantry,Boxford BakehouseBoxford Bakehouse,$12.49,8.0 Ounce,,False,False,2025-03-08T10:33:49.180402
Organic Triple C Mix,pantry,Boxford BakehouseBoxford Bakehouse,$8.19,8.0 Ounce,,False,False,2025-03-08T10:33:49.203120
Turkish Dried Apricots,pantry,Boxford BakehouseBoxford Bakehouse,$8.99,8.0 Ounce,,False,False,2025-03-08T10:33:49.225541
Roasted Unsalted Almonds,pantry,Boxford BakehouseBoxford Bakehouse,$10.99,8.0 Ounce,,False,False,2025-03-08T10:33:49.248913
Raw Pecans (halves),pantry,Boxford BakehouseBoxford Bakehouse,$14.99,8.0 Ounce,,False,False,2025-03-08T10:33:49.270824
Tamari Roasted Almonds,pantry,Boxford BakehouseBoxford Bakehouse,$11.99,8.0 Ounce,,False,False,2025-03-08T10:33:49.315116
Whole Raw Cashews,pantry,Boxford BakehouseBoxford Bakehouse,$10.99,8.0 Ounce,,False,False,2025-03-08T10:33:49.338286
Black Mission Figs,pantry,Boxford BakehouseBoxford Bakehouse,$9.99,8.0 Ounce,,False,False,2025-03-08T10:33:49.360068
Everything Bagel Cashews,pantry,Boxford BakehouseBoxford Bakehouse,$12.49,8.0 Ounce,,False,False,2025-03-08T10:33:49.385173
Honey Sriracha Cashews,pantry,Boxford BakehouseBoxford Bakehouse,$12.89,8.0 Ounce,,False,False,2025-03-08T10:33:49.410471
Raw California Almonds,pantry,Boxford BakehouseBoxford Bakehouse,$12.49,8.0 Ounce,,False,False,2025-03-08T10:33:49.434022
Sultana Raisins,pantry,Boxford BakehouseBoxford Bakehouse,$5.99,8.0 Ounce,,False,False,2025-03-08T10:33:49.456718
Macadamia Nuts,pantry,Boxford BakehouseBoxford Bakehouse,$10.99,4.0 Ounce,,False,False,2025-03-08T10:33:49.480066
Dried Cranberries,pantry,Boxford BakehouseBoxford Bakehouse,$7.99,8.0 Ounce,,False,False,2025-03-08T10:33:49.502706
Mexican Chocolate Almonds,pantry,Q's NutsQ's Nuts,$9.99,5.0 Ounce,,False,False,2025-03-08T10:33:49.525712
Key Lime Ginger Almonds,pantry,Q's NutsQ's Nuts,$8.99,5.0 Ounce,,False,False,2025-03-08T10:33:49.547825
Banana Foster Pecans,pantry,Q's NutsQ's Nuts,$9.99,5.0 Ounce,,False,False,2025-03-08T10:33:49.570969
Salted Hazelnuts,pantry,Freddy Guy's HazelnutsFreddy Guy's Hazelnut...,$8.99,7.0 Ounce,,False,False,2025-03-08T10:33:49.593225
Pepitas Brined and Roasted Heirloom Pumpkin Seeds,pantry,Stony Brook Wholehearted FoodsStony Brook Wholehear...,$4.99,3.0 Ounce,,False,False,2025-03-08T10:33:49.616613
Maple Pepitas Roasted Pumpkin Seeds with Maple Syrup,pantry,Stony Brook Wholehearted FoodsStony Brook Wholehear...,$4.99,3.0 Ounce,,False,False,2025-03-08T10:33:49.638833
Sweet Chili Butternut Pepitas,pantry,Stony Brook Wholehearted FoodsStony Brook Wholehear...,$4.99,3.0 Ounce,,False,False,2025-03-08T10:33:49.661664
Tamari Pumpkin Seeds,pantry,Boxford BakehouseBoxford Bakehouse,$9.99,8.0 Ounce,,False,False,2025-03-08T10:33:49.684310
"Raw Pistachios, In-Shell (Organic)",pantry,Boxford BakehouseBoxford Bakehouse,$9.99,8.0 oz,,False,False,2025-03-08T10:33:49.707510
Oatmeal Raisin Breakfast Bar,pantry,Cloudy Lane BakeryCloudy Lane Bakery,$4.99,1 bar,,False,False,2025-03-08T10:33:49.752246
Chocolate Chip Blondie Bar,pantry,Cloudy Lane BakeryCloudy Lane Bakery,$4.99,1 bar (45 grams),,False,False,2025-03-08T10:33:49.774335
Cranberry Cashew Nut Butter Bar,pantry,Big Spoon RoastersBig Spoon Roasters,$3.99,2.1 Ounce,,False,False,2025-03-08T10:33:49.797566
Apricot Pepita Nut Butter Bar,pantry,Big Spoon RoastersBig Spoon Roasters,$3.99,2.1 Ounce,,False,False,2025-03-08T10:33:49.830613
Cherry Chocolate Nut Butter Bar,pantry,Big Spoon RoastersBig Spoon Roasters,$3.99,2.1 Ounce,,False,False,2025-03-08T10:33:49.878186
Chewy Granola Bars,pantry,The Native Bread and PastryThe Native Bread and ...,$5.49,1 piece,,False,False,2025-03-08T10:33:49.947811
Honey Almond Granola,pantry,Hawthorne Valley FarmHawthorne Valley Farm,$5.99,8.0 Ounce,,False,False,2025-03-08T10:33:49.970396
Maple Walnut Granola,pantry,Hawthorne Valley FarmHawthorne Valley Farm,$5.99,8.0 Ounce,,False,False,2025-03-08T10:33:49.992809
Aged Cheddar Granola with Black Pepper,pantry,Jamie's Farm New YorkJamie's Farm New York,$12.99,8.0 oz,,False,False,2025-03-08T10:33:50.017496
Vanilla Bean Granola with Sour Cherries,pantry,Jamie's Farm New YorkJamie's Farm New York,$12.99,8.0 Ounce,,False,False,2025-03-08T10:33:50.040879
Chai Streusel Granola with Honey,pantry,Jamie's Farm New YorkJamie's Farm New York,$12.99,8.0 Ounce,,False,False,2025-03-08T10:33:50.063933
Rosemary Granola with Currants,pantry,Jamie's Farm New YorkJamie's Farm New York,$12.99,8.0 Ounce,,False,False,2025-03-08T10:33:50.086796
Maple Pecan Granola with Sea Salt,pantry,Jamie's Farm New YorkJamie's Farm New York,$12.99,8.0 oz,,False,False,2025-03-08T10:33:50.174021
Blueberry Dino Bar,pantry,Dino BarsDino Bars,$2.49,1.05 oz,,False,False,2025-03-08T10:33:50.196325
Strawberry Dino Bar,pantry,Dino BarsDino Bars,$2.49,1.05 oz,,False,False,2025-03-08T10:33:50.218668
Mango Dino Bar,pantry,Dino BarsDino Bars,$2.49,1.05 oz,,False,False,2025-03-08T10:33:50.241081
Pineapple Carrot Dino Bar,pantry,Dino BarsDino Bars,$2.49,1.05 oz,,False,False,2025-03-08T10:33:50.263328
Dark Chocolate Ganache Bar,pantry,Cloudy Lane BakeryCloudy Lane Bakery,$4.99,1 bar (45 grams),,False,True,2025-03-08T10:33:50.286952
Salsa Verde,pantry,Farm To People KitchenFarm To People Kitche...,$5.99,8 oz,,False,False,2025-03-08T10:33:50.309418
Original Hummus,pantry,Farm To People KitchenFarm To People Kitche...,$6.99,8 oz,,False,False,2025-03-08T10:33:50.332442
Zesty Za'atar Hummus,pantry,Farm To People KitchenFarm To People Kitche...,$6.99,8 oz,,False,False,2025-03-08T10:33:50.354873
Garlic Confit Hummus,pantry,Farm To People KitchenFarm To People Kitche...,$7.99,8 oz,,False,False,2025-03-08T10:33:50.377108
Guacamole,pantry,Farm To People KitchenFarm To People Kitche...,$7.99,8 oz,,False,False,2025-03-08T10:33:50.399979
Tzatziki,pantry,Farm To People KitchenFarm To People Kitche...,$4.99,8 oz,,False,False,2025-03-08T10:33:50.422566
Wild-Caught Tuna Salad,pantry,Farm To People KitchenFarm To People Kitche...,$6.99,8 oz,,False,False,2025-03-08T10:33:50.444330
Basil Pesto,pantry,Farm To People KitchenFarm To People Kitche...,$9.99,8 oz,,False,False,2025-03-08T10:33:50.467166
Tomatillo Salsa,pantry,Kitchen Garden FarmKitchen Garden Farm,$12.99,11.0 Ounce,,False,False,2025-03-08T10:33:50.489675
Roasted Chili Salsa,pantry,Kitchen Garden FarmKitchen Garden Farm,$12.99,11.0 Ounce,,False,False,2025-03-08T10:33:50.512071
Vegan Cilantro Pistachio Pesto,pantry,Farm To People KitchenFarm To People Kitche...,$8.99,8 oz,,False,False,2025-03-08T10:33:50.534775
Chickpea 'Un-tuna' Salad,pantry,Farm To People KitchenFarm To People Kitche...,$6.99,8 oz,,False,False,2025-03-08T10:33:50.557367
Guasacaca,pantry,Farm To People KitchenFarm To People Kitche...,$6.99,8 oz,,False,False,2025-03-08T10:33:50.579721
Chimichurri,pantry,Farm To People KitchenFarm To People Kitche...,$7.99,8 oz,,False,False,2025-03-08T10:33:50.602588
Giardiniera Spicy Pickled Vegetables,pantry,Kitchen Garden FarmKitchen Garden Farm,$15.99,19.6 Ounce,,False,False,2025-03-08T10:33:50.625742
Pickled Daikon Kimchi,pantry,Mama O'sMama O's,$10.39,1.0 Lbs,,False,False,2025-03-08T10:33:50.658317
Kimchi Paste,pantry,Mama O'sMama O's,$10.39,6.0 Ounce,,False,False,2025-03-08T10:33:50.700941
Baby Bok Choy Kimchi,pantry,Mama O'sMama O's,$12.59,1.0 Lbs,,False,False,2025-03-08T10:33:50.722629
Vegan Kimchi,pantry,Mama O'sMama O's,$10.39,1.0 Lbs,,False,False,2025-03-08T10:33:50.744201
Vegan Kimchi Paste,pantry,Mama O'sMama O's,$9.49,6.0 Ounce,,False,False,2025-03-08T10:33:50.766445
Pickled Red Onions,pantry,Farm To People KitchenFarm To People Kitche...,$5.99,8 oz,,False,False,2025-03-08T10:33:50.788025
Ginger Carrots Kraut,pantry,Hawthorne Valley FarmHawthorne Valley Farm,$12.99,16.0 Ounce,,False,False,2025-03-08T10:33:50.809333
Original Sauerkraut,pantry,Hawthorne Valley FarmHawthorne Valley Farm,$9.99,16.0 Ounce,,False,False,2025-03-08T10:33:50.831263
The People's Pickle,pantry,Rick's PicksRick's Picks,$9.99,24.0 Ounce,,False,False,2025-03-08T10:33:50.852578
Hotties Spicy Sriracha Pickle Chips,pantry,Rick's PicksRick's Picks,$9.99,24.0 Ounce,,False,False,2025-03-08T10:33:50.874375
Mean Beans,pantry,Rick's PicksRick's Picks,$11.99,15.0 Ounce,,False,False,2025-03-08T10:33:50.896834
Mellow Red Miso,pantry,Rhapsody Natural FoodsRhapsody Natural Food...,$14.49,16.0 Ounce,,False,False,2025-03-08T10:33:50.918846
Sweet White Miso,pantry,Rhapsody Natural FoodsRhapsody Natural Food...,$14.49,16.0 Ounce,,False,False,2025-03-08T10:33:50.940584
Non-Pareil Capers,pantry,MinaMina,$4.99,7.0 oz,,False,False,2025-03-08T10:33:50.961919
Pitted Green Olives,pantry,MinaMina,$4.69,12.5 oz,,False,False,2025-03-08T10:33:50.983509
Green Olives,pantry,MinaMina,$4.69,12.5 oz,,False,False,2025-03-08T10:33:51.005513
Purple Beldi Olives,pantry,MinaMina,$4.69,12.5 oz,,False,False,2025-03-08T10:33:51.026645
Dry Cured Black Olives,pantry,MinaMina,$4.69,7.0 oz,,False,False,2025-03-08T10:33:51.048745
Dilly Scapes,pantry,Somewhere in Time FarmSomewhere in Time Far...,$14.99,16.0 Ounce,,False,False,2025-03-08T10:33:51.070262
Ruby Sauerkraut,pantry,Hawthorne Valley FarmHawthorne Valley Farm,$9.99,16.0 Ounce,,False,True,2025-03-08T10:33:51.091883
Caraway Sauerkraut,pantry,Hawthorne Valley FarmHawthorne Valley Farm,$9.99,16.0 Ounce,,False,True,2025-03-08T10:33:51.113528
Turmeric Feuerkraut Sauerkraut,pantry,Hawthorne Valley FarmHawthorne Valley Farm,$12.99,16.0 Ounce,,False,True,2025-03-08T10:33:51.135398
Organic Apple Cider Vinegar,pantry,Peachey's Fruit FarmPeachey's Fruit Farm,$11.99,32.0 oz,,False,False,2025-03-08T10:33:51.156843
Aria Extra Virgin Olive Oil (Tin),pantry,Aralia Olive OilsAralia Olive Oils,$43.99,3.0 Litre,,False,False,2025-03-08T10:33:51.178472
Zoe Extra Virgin Olive Oil,pantry,ZoeZoe,$59.99,3.0 Litre,,False,False,2025-03-08T10:33:51.200183
Organic Zoe Extra Virgin Olive Oil,pantry,ZoeZoe,$64.99,88.0 Fluid Ounce,,False,False,2025-03-08T10:33:51.222321
Canola Oil,pantry,Susquehanna Mills Co.Susquehanna Mills Co.,$14.99,750.0 Milliliter,,False,False,2025-03-08T10:33:51.243571
Truffle Oil,pantry,The TruffleistThe Truffleist,$10.99,2.0 Ounce,,False,False,2025-03-08T10:33:51.265898
Avocado Oil,pantry,La TourangelleLa Tourangelle,$21.49,16.9 Ounce,,False,False,2025-03-08T10:33:51.287373
Toasted Sesame Oil,pantry,La TourangelleLa Tourangelle,$15.99,16.9 Ounce,,False,False,2025-03-08T10:33:51.309166
100% Grass-fed Beef Tallow,pantry,Farm To People KitchenFarm To People Kitche...,$8.99,8.0 oz,,False,False,2025-03-08T10:33:51.330708
Chicken Schmaltz,pantry,Farm To People KitchenFarm To People Kitche...,$8.99,6 oz,,False,False,2025-03-08T10:33:51.353007
That Balsamic,pantry,Farm to PeopleFarm to People,$24.99,16.0 Ounce,,False,False,2025-03-08T10:33:51.374438
Organic Rice Vinegar,pantry,Wan Ja ShanWan Ja Shan,$7.99,15.0 Fluid Ounce,,False,False,2025-03-08T10:33:51.396058
Sweet Mirin Rice Wine,pantry,Wan Ja ShanWan Ja Shan,$7.99,15.0 Ounce,,False,False,2025-03-08T10:33:51.417812
100% Grass-fed Beef Suet,pantry,Hardwick BeefHardwick Beef,N/A,"2-2.5 lbs, avg $17.98",$7.99/ lb,False,False,2025-03-08T10:33:51.439403
Aria Extra Virgin Olive Oil,pantry,Aralia Olive OilsAralia Olive Oils,$18.99,500.0 Milliliter,,False,True,2025-03-08T10:33:51.460858
Pure Kosher Sea Salt,pantry,Jacobsen Salt Co.Jacobsen Salt Co.,$12.99,1.0 Lbs,,False,False,2025-03-08T10:33:51.483010
Pure Italian Fine Sea Salt,pantry,Jacobsen Salt Co.Jacobsen Salt Co.,$8.99,1.8 Lbs,,False,False,2025-03-08T10:33:51.504289
Truffle Salt,pantry,The TruffleistThe Truffleist,$19.99,4.0 Ounce,,False,False,2025-03-08T10:33:51.526215
Royal Cinnamon,pantry,Burlap & BarrelBurlap & Barrel,$8.29,1.8 Ounce,,False,False,2025-03-08T10:33:51.547569
Purple Stripe Garlic Powder,pantry,Burlap & BarrelBurlap & Barrel,$8.29,1.8 Ounce,,False,False,2025-03-08T10:33:51.568942
Smoked Pimenton Paprika,pantry,Burlap & BarrelBurlap & Barrel,$7.99,1.8 Ounce,,False,False,2025-03-08T10:33:51.591183
Sweet Pepper Paprika,pantry,Burlap & BarrelBurlap & Barrel,$8.99,1.8 Ounce,,False,False,2025-03-08T10:33:51.612789
Cobanero Chili,pantry,Burlap & BarrelBurlap & Barrel,$8.99,1.5 Ounce,,False,False,2025-03-08T10:33:51.633938
Ground New Harvest Turmeric,pantry,Burlap & BarrelBurlap & Barrel,$9.99,1.9 Ounce,,False,False,2025-03-08T10:33:51.655969
Cured Sumac,pantry,Burlap & BarrelBurlap & Barrel,$9.99,1.8 Ounce,,False,False,2025-03-08T10:33:51.677447
Ground Black Lime,pantry,Burlap & BarrelBurlap & Barrel,$8.99,1.7 Ounce,,False,False,2025-03-08T10:33:51.699456
Ground Buffalo Ginger,pantry,Burlap & BarrelBurlap & Barrel,$8.99,1.8 Ounce,,False,False,2025-03-08T10:33:51.720770
Ground Laurel Bay Leaves,pantry,Burlap & BarrelBurlap & Barrel,$9.99,1.5 Ounce,,False,False,2025-03-08T10:33:51.742719
Wild Mountain Cumin Seeds,pantry,Burlap & BarrelBurlap & Barrel,$9.99,1.5 Ounce,,False,False,2025-03-08T10:33:51.764225
Flowering Hyssop Thyme,pantry,Burlap & BarrelBurlap & Barrel,$8.29,0.8 Ounce,,False,False,2025-03-08T10:33:51.785680
Pemba Cloves,pantry,Burlap & BarrelBurlap & Barrel,$8.99,1.4 Ounce,,False,False,2025-03-08T10:33:51.807807
Ground Sweet Allspice,pantry,Burlap & BarrelBurlap & Barrel,$8.29,2.0 Ounce,,False,False,2025-03-08T10:33:51.829951
Cloud Forest Cardamom,pantry,Burlap & BarrelBurlap & Barrel,$9.99,1.7 Ounce,,False,False,2025-03-08T10:33:51.851724
Robusta Black Peppercorns (Bulk Size),pantry,Burlap & BarrelBurlap & Barrel,$35.99,16.0 Ounce,,False,False,2025-03-08T10:33:51.873706
Ea Sar Black Pepper,pantry,Burlap & BarrelBurlap & Barrel,$8.29,1.8 Ounce,,False,False,2025-03-08T10:33:51.895208
Za'atar,pantry,New York ShukNew York Shuk,$10.99,1.5 Ounce,,False,False,2025-03-08T10:33:51.916822
Curry Powder,pantry,Burlap & BarrelBurlap & Barrel,$8.99,2.1 Ounce,,False,False,2025-03-08T10:33:51.938446
Toasted Onion Powder,pantry,Burlap & BarrelBurlap & Barrel,$7.00,2.9 Ounce,,False,False,2025-03-08T10:33:51.960052
Jimmy Nardello Sweet Pepper Flakes,pantry,Burlap & BarrelBurlap & Barrel,$10.99,0.9 Ounce,,False,False,2025-03-08T10:33:51.981690
Dried Wild Ramps,pantry,Burlap & BarrelBurlap & Barrel,$19.99,0.9 Ounce,,False,False,2025-03-08T10:33:52.002887
Ground Red River Coriander,pantry,Burlap & BarrelBurlap & Barrel,$8.29,2.0 Ounce,,False,False,2025-03-08T10:33:52.024559
Herbes de Provence,pantry,Burlap & BarrelBurlap & Barrel,$9.99,0.8 Ounce,,False,False,2025-03-08T10:33:52.046736
Chai Spice,pantry,Burlap & BarrelBurlap & Barrel,$9.99,2.0 Ounce,,False,False,2025-03-08T10:33:52.069700
Nothing Hidden Ranch Powder,pantry,Burlap & BarrelBurlap & Barrel,$11.99,2.7 Ounce,,False,False,2025-03-08T10:33:52.091926
Yo Quiero Taco Blend,pantry,Burlap & BarrelBurlap & Barrel,$11.99,2.6 Ounce,,False,False,2025-03-08T10:33:52.113406
Spicy & Smoky Grilling Rub,pantry,Burlap & BarrelBurlap & Barrel,$11.99,1.7 Ounce,,False,False,2025-03-08T10:33:52.134830
Ground Grenada Gold Nutmeg,pantry,Burlap & BarrelBurlap & Barrel,$9.49,1.0 oz,,False,False,2025-03-08T10:33:52.157349
Dried Calabrian Chili Flakes,pantry,Kitchen Garden FarmKitchen Garden Farm,$12.99,1.0 Ounce,,False,False,2025-03-08T10:33:52.180919
Half White Bread Flour,pantry,Farmer Ground FlourFarmer Ground Flour,$6.99,2.0 Lbs,,False,False,2025-03-08T10:33:52.230007
Cane Sugar Fair Trade,pantry,Wholesome OrganicsWholesome Organics,$7.99,2.0 Lbs,,False,False,2025-03-08T10:33:52.376518
Organic Dark Brown Sugar,pantry,Wholesome OrganicsWholesome Organics,$9.99,24.0 Ounce,,False,False,2025-03-08T10:33:52.398759
Organic Light Brown Sugar,pantry,Wholesome OrganicsWholesome Organics,$9.99,24.0 Ounce,,False,False,2025-03-08T10:33:52.420526
Organic Powdered Confectioners Sugar,pantry,Wholesome OrganicsWholesome Organics,$5.99,1.0 Lbs,,False,False,2025-03-08T10:33:52.442855
Muscovado Light Brown Sugar,pantry,Billington's NaturalBillington's Natural,$4.99,1.0 Lbs,,False,False,2025-03-08T10:33:52.464621
Madagascar Vanilla Extract,pantry,Beyond GoodBeyond Good,$13.99,2.0 Ounce,,False,False,2025-03-08T10:33:52.486262
Madagascar Vanilla Beans,pantry,Beyond GoodBeyond Good,$24.99,2 beans,,False,False,2025-03-08T10:33:52.508438
Organic Puff Pastry,pantry,Fillo FactoryFillo Factory,$12.99,16.0 Ounce,,False,False,2025-03-08T10:33:52.530263
Organic Fillo Dough,pantry,Fillo FactoryFillo Factory,$8.49,1.0 Lbs,,False,False,2025-03-08T10:33:52.551645
Organic Coconut Milk,pantry,Native ForestNative Forest,$5.59,13.5 Ounce,,False,False,2025-03-08T10:33:52.573754
Puff Pastry,pantry,Dufour Pastry KitchenDufour Pastry Kitchen,$15.99,14.0 oz,,False,False,2025-03-08T10:33:52.677331
Pumpkin Puree,pantry,First FieldFirst Field,$13.99,16.5 Ounce,,False,False,2025-03-08T10:33:52.698974
Buttermilk Pancake Mix,pantry,Phoenicia DinerPhoenicia Diner,$12.99,20.0 oz,,False,False,2025-03-08T10:33:52.720587
Buckwheat Pancake Mix,pantry,Phoenicia DinerPhoenicia Diner,$12.99,20.0 oz,,False,False,2025-03-08T10:33:52.742875
Vegan Pancake Mix,pantry,Phoenicia DinerPhoenicia Diner,$11.04,20.0 oz,,False,False,2025-03-08T10:33:52.764310
Canned Pumpkin Puree,pantry,Farmer's MarketFarmer's Market,$6.29,15.0 Ounce,,False,False,2025-03-08T10:33:52.785609
Brooklyn Bolognese,pantry,Farm To People KitchenFarm To People Kitche...,$14.99,16 oz,,False,False,2025-03-08T10:33:52.908887
Classic Red Tomato Sauce,pantry,Jule'sJule's,$8.99,16.0 Ounce,,False,False,2025-03-08T10:33:52.930410
Classic Spicy Tomato Sauce,pantry,Jule'sJule's,$9.99,16.0 Ounce,,False,False,2025-03-08T10:33:52.951635
Classic Vodka Tomato Sauce,pantry,Jule'sJule's,$9.99,16.0 Ounce,,False,False,2025-03-08T10:33:52.973849
Dairy-Free Vodka Tomato Sauce,pantry,Jule'sJule's,$9.99,16.0 Ounce,,False,False,2025-03-08T10:33:52.995553
Jersey Fresh Canned Crushed Tomatoes,pantry,Jersey FreshJersey Fresh,$6.49,28.0 Ounce,,False,False,2025-03-08T10:33:53.017312
Sichuan Chili Crisp,pantry,Fly by JingFly by Jing,$16.99,6.0 Ounce,,False,False,2025-03-08T10:33:53.039046
Sesame Premium Tahini,pantry,Soom FoodsSoom Foods,$9.99,11.0 Ounce,,False,False,2025-03-08T10:33:53.060711
Cranberry Sauce,pantry,First FieldFirst Field,$13.99,10.5 Ounce,,False,False,2025-03-08T10:33:53.082695
Less Sodium Soy Sauce,pantry,Wan Ja ShanWan Ja Shan,$4.99,10.0 Ounce,,False,False,2025-03-08T10:33:53.124881
Gluten-Free Tamari,pantry,Wan Ja ShanWan Ja Shan,$5.99,10.0 Ounce,,False,False,2025-03-08T10:33:53.146516
Soy Sauce,pantry,Wan Ja ShanWan Ja Shan,$4.99,10.0 Ounce,,False,False,2025-03-08T10:33:53.167986
Fish Sauce,pantry,Red BoatRed Boat,$11.99,250.0 Milliliter,,False,False,2025-03-08T10:33:53.189928
Worcestershire Sauce,pantry,Wan Ja ShanWan Ja Shan,$4.99,10.0 Ounce,,False,False,2025-03-08T10:33:53.211810
Thai Peanut Lime Sauce,pantry,Farm To People KitchenFarm To People Kitche...,$7.99,8 oz,,False,False,2025-03-08T10:33:53.233430
Classic Ginger Saffron Simmer Sauce,pantry,MinaMina,$6.99,12.0 oz,,False,False,2025-03-08T10:33:53.255368
"Tomato, Herbs, & Spices Simmer Sauce",pantry,MinaMina,$6.99,12.0 oz,,False,False,2025-03-08T10:33:53.276915
Royal Ras El Hanout Simmer Sauce,pantry,MinaMina,$6.99,12.0 oz,,False,False,2025-03-08T10:33:53.298679
Shakshuka Sauce,pantry,MinaMina,$7.99,16.0 oz,,False,False,2025-03-08T10:33:53.320346
Ketchup,pantry,True Made FoodsTrue Made Foods,$4.99,17.0 Ounce,,False,False,2025-03-08T10:33:53.362478
Honey Mustard,pantry,True Made FoodsTrue Made Foods,$4.49,12.0 Ounce,,False,False,2025-03-08T10:33:53.383786
Dijon Mustard,pantry,Edmond FallotEdmond Fallot,$6.99,7.4 Ounce,,False,False,2025-03-08T10:33:53.405527
Stone Ground Mustard,pantry,Edmond FallotEdmond Fallot,$6.99,7.2 Ounce,,False,False,2025-03-08T10:33:53.427390
Classic Mayonnaise,pantry,Sir Kensington'sSir Kensington's,$9.99,12.0 Ounce,,False,False,2025-03-08T10:33:53.448866
Vegan Mayo,pantry,Sir Kensington'sSir Kensington's,$12.99,12.0 Ounce,,False,False,2025-03-08T10:33:53.470222
